B1: netAces.org Fighter Round Power

G1: The table below shows the relative power of the various fighter weapons in Aces High II based on the number of rounds required to kill a hangar from point blank range. This value is shown in the RtKH (Rounds to Kill Hangar) column of the chart. The "Relative Power" column then compares the power of that round against the U.S. .50 cal round, which is given a value of "1". The next two columns give possible expected power of the round based on Tony Williams' article WW2 Fighter Armament Effectiveness from Tony Williams' Website. The numbers from the "Power" column were adjusted to give the .50 cal round a rating of "1" for direct comparison with the RtKH numbers.

A1: Country | B1: Weapon | C1: Round | D1: RtKH | E1: Relative Power | F1: Expected Power 1 | G1: Expected Power 2
A2: USSR | B2: NS 37 | C2: 37mm | D2: 162 | E2: =2374/D2 -> 14.654320987654321 | F2: =106/4.6 -> 23.043478260869566 | G2: --
A3: England | B3: 40mm Vickers | C3: 40mm | D3: 198 | E3: =2374/D3 -> 11.98989898989899 | F3: -- | G3: --
A4: Germany | B4: Mk 108 | C4: 30x90RB | D4: 238 | E4: =2374/D4 -> 9.9747899159663866 | F4: =58/4.6 -> 12.608695652173914 | G4: 23.03
A5: U.S. | B5: M2 20mm | C5: 20x110 | D5: 685 | E5: =2374/D5 -> 3.4656934306569345 | F5: =20/4.6 -> 4.3478260869565224 | G5: 4.86
A6: U.S. | B6: M1 20mm | C6: 20x110 | D6: 685 | E6: =2374/D6 -> 3.4656934306569345 | F6: =20/4.6 -> 4.3478260869565224 | G6: --
A7: England | B7: Hispano II | C7: 20x110 | D7: 685 | E7: =2374/D7 -> 3.4656934306569345 | F7: =20/4.6 -> 4.3478260869565224 | G7: --
A8: England | B8: Hispano V | C8: 20x110 | D8: 703 | E8: =2374/D8 -> 3.3769559032716927 | F8: =20/4.6 -> 4.3478260869565224 | G8: --
A9: Japan | B9: Type 99 Mk2 | C9: 20x101RB | D9: 720 | E9: =2374/D9 -> 3.2972222222222221 | F9: =15/4.6 -> 3.2608695652173916 | G9: --
A10: Germany | B10: MG 151/20 | C10: 20x82 | D10: 785 | E10: =2374/D10 -> 3.0242038216560512 | F10: =16/4.6 -> 3.4782608695652177 | G10: 6.53
A11: USSR | B11: ShVAK | C11: 20x99R | D11: 799 | E11: =2374/D11 -> 2.9712140175219024 | F11: =11/4.6 -> 2.3913043478260874 | G11: --
A12: USSR | B12: B-20 | C12: 20x99R | D12: 799 | E12: =2374/D12 -> 2.9712140175219024 | F12: =11/4.6 -> 2.3913043478260874 | G12: --
A13: Japan | B13: Type 99 Mk1 | C13: 20x72RB | D13: 808 | E13: =2374/D13 -> 2.9381188118811883 | F13: =12/4.6 -> 2.6086956521739131 | G13: --
A14: Japan | B14: Ho-5 | C14: 20x94 | D14: 829 | E14: =2374/D14 -> 2.8636911942098915 | F14: =11/4.6 -> 2.3913043478260874 | G14: 3.39
A15: Germany | B15: MG-FF | C15: 20x80RB | D15: 857 | E15: =2374/D15 -> 2.7701283547257876 | F15: =14/4.6 -> 3.0434782608695654 | G15: --
A16: U.S. | B16: M2 .50cal | C16: 12.7x99 | D16: 2374 | E16: 1 | F16: 1 | G16: 1
A17: USSR | B17: UBS | C17: 12.7x108 | D17: 2406 | E17: =2374/D17 -> 0.98669991687448044 | F17: =5.7/4.6 -> 1.2391304347826089 | G17: --
A18: Italy | B18: Breda-SAFAT | C18: 12.7x81SR | D18: 2919 | E18: =2374/D18 -> 0.81329222336416584 | F18: =3/4.6 -> 0.65217391304347827 | G18: 0.63
A19: Japan | B19: Ho-103 | C19: 12.7x81SR | D19: 2782 | E19: =2374/D19 -> 0.85334291876347956 | F19: =3/4.6 -> 0.65217391304347827 | G19: --
A20: Germany | B20: MG 131 | C20: 13x64B | D20: 3017 | E20: =2374/D20 -> 0.78687437852171027 | F20: =3.2/4.6 -> 0.69565217391304357 | G20: 0.44
A21: England | B21: Browning .303 | C21: 7.7x56R | D21: 9368 | E21: =2374/D21 -> 0.25341588385994879 | F21: =1/4.6 -> 0.21739130434782611 | G21: 0.25
A22: Germany | B22: MG 17 | C22: 7.92x57 | D22: 9369 | E22: =2374/D22 -> 0.25338883552140035 | F22: =1/4.6 -> 0.21739130434782611 | G22: --
A23: Japan | B23: Type 97 | C23: 7.7mm | D23: 9370 | E23: =2374/D23 -> 0.25336179295624334 | F23: -- | G23: --

G1: Test Procedures: Testing was done off-line with Arena Settings set to "Default" and "Protect Objects" turned off so I could destroy friendly hangars. I simply rolled a fighter up to a hangar and blasted away. Once I had an approximate number of rounds, I repeated the process until I could duplicate the number of rounds required to destroy the hangar.